<?xml version="1.0" encoding="UTF-8"?>

<!--
 -=-=-=-=-=-=-=-=-=-=-=-=-=-=-=-=-=-=-=-=-=-=-=-=-=-=-=-=-=-=-=-=-=-=-=-=-=-
 -  Copyright 2011 Trimble, Inc.

 -  Copyright 2006, 2007 EPCglobal Inc.
 -     (The proprietary text of EPCglobal Inc. included herein is not
 -      a Contribution to the work. The right to use the proprietary
 -      text is limited to reproduction and display thereof within
 -      the work.)

 -  Licensed under the Apache License, Version 2.0 (the "License");
 -  you may not use this file except in compliance with the License.
 -  You may obtain a copy of the License at
 -
 -      http://www.apache.org/licenses/LICENSE-2.0
 -
 -  Unless required by applicable law or agreed to in writing, software
 -  distributed under the License is distributed on an "AS IS" BASIS,
 -  WITHOUT WARRANTIES OR CONDITIONS OF ANY KIND, either express or implied.
 -  See the License for the specific language governing permissions and
 -  limitations under the License.
 -
 -=-=-=-=-=-=-=-=-=-=-=-=-=-=-=-=-=-=-=-=-=-=-=-=-=-=-=-=-=-=-=-=-=-=-=-=-=-
 -->

<llrpdef
	xmlns="http://www.llrp.org/ltk/schema/core/encoding/binary/1.0"
        xmlns:xsi="http://www.w3.org/2001/XMLSchema-instance"
        xmlns:h="http://www.w3.org/1999/xhtml"
        xsi:schemaLocation="
		  http://www.llrp.org/ltk/schema/core/encoding/binary/1.0
		  http://www.llrp.org/ltk/schema/core/encoding/binary/1.0/llrpdef.xsd"
>

<vendorDefinition       name="thingmagic" vendorID="26554" />
<namespaceDefinition    prefix="thingmagic"
	URI="http://www.thingmagic.com/ltk/schema/extension/xml/1.0/"
                        schemaLocation="http://www.thingmagic.com/ltk/schema/extension/xml/1.0/thingmagic.xsd" />
<customMessageDefinition        name="THINGMAGIC_CONTROL_REQUEST_POWER_CYCLE_READER"
                                vendor="thingmagic" subtype="1"
                                namespace="thingmagic"
				responseType="THINGMAGIC_CONTROL_RESPONSE_POWER_CYCLE_READER">
  <annotation>
    <documentation>
    </documentation>
    <description copyright="">
      <h:p>power cycle the ThingMagic reader</h:p>
    </description>
  </annotation>
  <field type="u32" name="MagicNumber"/>
  <field type="u1" name="BootToSafeMode"/> 
  <reserved bitCount="7"/> 
  <parameter  repeat="0-N"    type="Custom"/>
</customMessageDefinition>

<customMessageDefinition        name="THINGMAGIC_CONTROL_RESPONSE_POWER_CYCLE_READER"
                                vendor="thingmagic" subtype="2"
                                namespace="thingmagic">
  <annotation>
    <documentation>
    </documentation>
    <description copyright="">
      <h:p>Response message to power cycle the ThingMagic reader request</h:p>
    </description>
  </annotation>
  <parameter  repeat="1"      type="LLRPStatus"/>
  <parameter  repeat="0-N"    type="Custom"/>
</customMessageDefinition>


<customMessageDefinition        name="THINGMAGIC_CONTROL_REQUEST_RESET_STATISTICS"
                                vendor="thingmagic" subtype="3"
                                namespace="thingmagic"
                                responseType="THINGMAGIC_CONTROL_RESPONSE_RESET_STATISTICS">
  <annotation>
    <documentation>
    </documentation>
    <description copyright="">
      <h:p>Reset reader statistics</h:p>
    </description>
  </annotation>
  <parameter  repeat="0-N"    type="Custom"/>
</customMessageDefinition>

<customMessageDefinition        name="THINGMAGIC_CONTROL_RESPONSE_RESET_STATISTICS"
                                vendor="thingmagic" subtype="4"
                                namespace="thingmagic">
  <annotation>
    <documentation>
    </documentation>
    <description copyright="">
      <h:p>Response message to power cycle the ThingMagic reader request</h:p>
    </description>
  </annotation>
  <parameter  repeat="1"      type="LLRPStatus"/>
  <parameter  repeat="0-N"    type="Custom"/>
</customMessageDefinition>


<customMessageDefinition        name="THINGMAGIC_CONTROL_REQUEST_GET_RESET_TIME"
                                vendor="thingmagic" subtype="5"
                                namespace="thingmagic"
                                responseType="THINGMAGIC_CONTROL_RESPONSE_GET_RESET_TIME">
  <annotation>
    <documentation>
    </documentation>
    <description copyright="">
      <h:p>Time stamp when reader statistics are reset</h:p>
    </description>
  </annotation>
  <parameter  repeat="0-N"    type="Custom"/>
</customMessageDefinition>

<customMessageDefinition        name="THINGMAGIC_CONTROL_RESPONSE_GET_RESET_TIME"
                                vendor="thingmagic" subtype="6"
                                namespace="thingmagic">
  <annotation>
    <documentation>
    </documentation>
    <description copyright="">
      <h:p>Response message to Get reset statistics time stamp request </h:p>
    </description>
  </annotation>
  <parameter  repeat="1"      type="LLRPStatus"/>
  <field type="u64" name="Microseconds" format="Datetime"/> 
  <parameter  repeat="0-N"    type="Custom"/>
</customMessageDefinition>


<customMessageDefinition        name="THINGMAGIC_CONTROL_REQUEST_GET_ANTENNA_STATS"
                                vendor="thingmagic" subtype="7"
                                namespace="thingmagic"
                                responseType="THINGMAGIC_CONTROL_RESPONSE_GET_ANTENNA_STATS">
  <annotation>
    <documentation>
    </documentation>
    <description copyright="">
      <h:p>Request to get Reader Antenna statistics.</h:p>
    </description>
  </annotation>
  <field type="u16" name="AntennaID"/>
  <parameter  repeat="0-N"    type="Custom"/>
</customMessageDefinition>

<customMessageDefinition        name="THINGMAGIC_CONTROL_RESPONSE_GET_ANTENNA_STATS"
                                vendor="thingmagic" subtype="8"
                                namespace="thingmagic">
  <annotation>
    <documentation>
    </documentation>
    <description copyright="">
      <h:p>Response message to get reader antenna statistics request</h:p>
    </description>
  </annotation>
  <parameter  repeat="1"      type="LLRPStatus"/>
  <field      type="u32"      name="TagsIdentified"/>
  <field      type="u32"      name="TagsNotIdentified"/>
  <field      type="u32"      name="MemoryReadFailures"/>
  <field      type="u32"      name="WriteOperations"/>
  <field      type="u32"      name="WriteFailures"/>
  <field      type="u32"      name="KillOperations"/>
  <field      type="u32"      name="KillFailures"/>
  <field      type="u32"      name="EraseOperations"/>
  <field      type="u32"      name="EraseFailures"/>
  <field      type="u32"      name="LockOperations"/>
  <field      type="u32"      name="LockFailures"/>
  <field      type="u32"      name="NoiseLevel"/>
  <field      type="u32"      name="TimeEnergised"/>
  <field      type="u32"      name="PowerLevel"/>
  <parameter  repeat="0-N"    type="Custom"/>
</customMessageDefinition>

<customMessageDefinition        name="THINGMAGIC_CONTROL_REQUEST_GET_READER_STATUS"
                                vendor="thingmagic" subtype="11"
                                namespace="thingmagic"
                                responseType="THINGMAGIC_CONTROL_RESPONSE_GET_READER_STATUS">
  <annotation>
    <documentation>
    </documentation>
    <description copyright="">
      <h:p>Request to get Reader device status.</h:p>
    </description>
  </annotation>
  <parameter  repeat="0-N"    type="Custom"/>
</customMessageDefinition>

<customMessageDefinition        name="THINGMAGIC_CONTROL_RESPONSE_GET_READER_STATUS"
                                vendor="thingmagic" subtype="12"
                                namespace="thingmagic">
  <annotation>
    <documentation>
    </documentation>
    <description copyright="">
      <h:p>Response message to power cycle the ThingMagic reader request</h:p>
    </description>
  </annotation>
  <parameter  repeat="1"      type="LLRPStatus"/>
  <field      type="u8"   	name="ReaderDeviceOperatingStatus"
			 	enumeration="ThingMagicReaderOperatingStatus"/>
  <parameter  repeat="0-N"    type="Custom"/>
</customMessageDefinition>

<customEnumerationDefinition    name="ThingMagicReaderOperatingStatus"
                                namespace="thingmagic">
  <annotation>
    <documentation>
    </documentation>
    <description copyright="">
      <h:p>An enumeration of ThingMagic Reader Device operating status</h:p>
    </description>
  </annotation>
  <entry     value="0"      name="IDLE"/>
  <entry     value="1"      name="RUNNING"/>
  <entry     value="2"      name="ERROR"/>
</customEnumerationDefinition>

<customParameterDefinition      name="ThingMagicDeviceControlCapabilities"
                                vendor="thingmagic" subtype="1"
                                namespace="thingmagic">
  <annotation>
    <documentation>
    </documentation>
    <description>
      <h:p>This parameter fills in the control plane capabilities that are specific to a thingmagic reader. </h:p>
    </description>
  </annotation>
  <field     	type="u8"   	name="RequestedData"
			 	enumeration="ThingMagicControlCapabilities"/>
  <parameter    repeat="0-N"    type="Custom"/>
  <allowedIn 	repeat="0-1"    type="GET_READER_CAPABILITIES"/>
</customParameterDefinition>

<customEnumerationDefinition    name="ThingMagicControlCapabilities"
                                namespace="thingmagic">
  <annotation>
    <documentation>
    </documentation>
    <description copyright="">
      <h:p>An enumeration of ThingMagic Control plane capabilities</h:p>
    </description>
  </annotation>
  <entry     value="0"      name="All"/>
  <entry     value="1"      name="DeviceInformationCapabilities"/>